{
  "schema_version": "1",
  "incident_id": "revenue-drop-4a37da",
  "authored_by": "the team, labelling its own synthetic data",
  "authored_at": "2026-09-23",
  "source_of_truth": "02_src/adii/examples/canonical_world.py: the world was generated knowing what happened in it; a development key, never an unseen one",
  "frozen": true,
  "freeze_note": "Frozen on authoring, 23 Sep 2026, before any run against it. The demo company's, reserved for the stage (decision E). A correction is a new key, never an edit.",
  "purpose": "The development set's label for this generated incident.",
  "correct_disposition": "ESCALATE",
  "correct_root_cause_id": null,
  "root_cause_explanation": "56 orders arrived and all were loaded, across every distributor alike. The manifest declares 110, but the vendor's receipt for the day was never received, so nothing independent says how many were sent, and the manifest service has a known counting fault. Either the vendor sent fewer orders or orders were lost before the load; no reachable evidence decides between them.",
  "repair_must_satisfy": {
    "description": "Not applicable: no repair should be proposed.",
    "reference_repair_id": null,
    "reference_patch_effect": null,
    "alternative_repairs_are_acceptable_if": [],
    "must_be_validated": false,
    "validation_requirement": "N/A"
  },
  "why_not_repair": "The orders that would be restored are not in the world; any repair would invent them.",
  "why_not_no_repair": "Calling the drop real ignores a manifest that disagrees with the load and a receipt that is missing."
}
