{
  "schema_version": "1",
  "incident_id": "revenue-drop-929623",
  "authored_by": "the team, labelling its own synthetic data",
  "authored_at": "2026-09-23",
  "source_of_truth": "02_src/adii/examples/canonical_world.py: the world was generated knowing what happened in it; a development key, never an unseen one",
  "frozen": true,
  "freeze_note": "Frozen on authoring, 23 Sep 2026, before any run against it. The demo company's, reserved for the stage (decision E). A correction is a new key, never an edit. Version 2 of revenue-drop-df8905, 23 Sep 2026 (decision A2): the same world and the same answer; only the alert changed, to name the orders it measured.",
  "purpose": "The development set's label for this generated incident.",
  "correct_disposition": "NO_REPAIR",
  "correct_root_cause_id": "DISTRIBUTOR_CONTRACTS_ENDED",
  "root_cause_explanation": "Juniper and Kiln placed no orders on 2026-08-18; every other distributor's volume is normal. Everything delivered was loaded (load_log SUCCESS, rows_loaded = rows_received = 56), and the manifest and the vendor receipt agree. The drop is real; the release that morning is unrelated.",
  "repair_must_satisfy": {
    "description": "Not applicable: no repair should be proposed.",
    "reference_repair_id": null,
    "reference_patch_effect": null,
    "alternative_repairs_are_acceptable_if": [],
    "must_be_validated": false,
    "validation_requirement": "N/A"
  },
  "why_not_repair": "Nothing is broken: the pipeline reports what arrived, and what arrived is all that was sent.",
  "why_not_escalate": "The evidence settles it: the source, the load, the manifest and the receipt agree, and the missing volume is exactly the distributors that stopped."
}
